{"manifest_version":2,"status":"complete","compatibility":{"support":"admitted","target_build":70205},"client":{"product":"wow_classic_beta","version":"1.60.1.70205","build":70205,"locale":"enUS"},"extractor":{"name":"forever-db2-extract","version":"0.1.0","implementation":"rust","compatibility_oracle_commit":"02245dcd245e7433e524577656177723d3e4992e"},"scope":"explicit_db2_batch","formats":{"db2":{"magic":"WDC5","version":5},"tables":[{"name":"ChrClasses","file_id":1361031,"table_hash":0,"layout_hash":0,"meta_index_field":0,"field_count":1}]},"options":{"locale":"enUS","table_selection":"default_character_tables","manifest_sha256":null,"entry_count":1,"max_file_bytes":16777216,"max_batch_bytes":268435456},"network":{"mode":"local","allow_network":false,"remote_casc":false,"lock_sha256":null,"downloaded_bytes":0},"outputs":{"root":".","incomplete_marker_present":false,"artifacts":[{"name":"ChrClasses","file_id":1361031,"relative_path":"ChrClasses.db2","status":"complete","bytes":32,"sha256":"b6fd55340217db1610ae3c4dbf00ddb7c1a2f5090d51082bbace61fa2dea15e0","declared_records":1,"table_schema_validated":true,"record_data_decoded":true,"decoded_rows":1}],"integrity":{"algorithm":"sha256","file_count":1,"total_bytes":32,"inventory_sha256":"6ae3823b5e947bd22a70127f76468445125d42943dccd635b82815a3a33ec87a"}},"timestamps":{"started_at":"2026-10-11T00:00:00Z","completed_at":"2026-10-11T00:00:00Z"},"privacy":{"paths_redacted":true,"client_data_embedded":false}}
